Rochester Institute of Technology,2016-03-25,2016-03-25 15:54:04,elcpro@rit.edu,2.0,Pursuing,**,True,"www.rit.edu/sustainability is the comprehensive university site that includes information about the Institute's sustainability efforts across academics, operations, and outreach.  ",http://www.rit.edu/sustainability/,--,,--,True,"Social media platforms have been utilized to further disseminate RIT sustainability information. Currently there is a Twitter feed, Facebook page and Instagram account for RIT's Sustainability office. All sustainability related student groups also maintain a social media presence.
",http://www.facebook.com/RITSustainability,True,"Academic Sustainable Papers:
Academic papers are an important part of RIT scholarship. Utilizing DSpace software, the Library has created an institutionalized repository that is open to all faculty and students, for both posting and reading access. The collection is searchable by title, author, subject or date. Visitors can access the collection by completion of an on-line registration. Sustainable collections are organized under RIT Green Sustainability Papers and have two categories addressing faculty and student scholarships. Those categories can be found by typing RIT Green in the search window of RIT’s Digital Media Library (DML).
",https://scholarworks.rit.edu/,True,"Each LEED certified building has a LEED demonstration wall which contains details of process and achievements of the building, including the LEED plaque. The most recently constructed buildings include an interactive kiosk and web-base dashboard that highlights the building performance and green features.",http://buildingdashboard.net/rit/#/rit,--,,--,--,,--,True,The Sustainability Features at RIT campus map that was designed by a graphic design student the map.  Student government is in the process of creating an interactive map.  ,--,True,"Information about all modes of alternative transportation available at RIT can be found at both the parking and transportation site as well as the sustainability website, including access to the where's my bus app.
",http://www.rit.edu/sustainability/transportation,True,"Recommended bike routes, bike safety, rules of the road, and bike share availability information is all available on RIT's parking and transportation website.  ",https://www.rit.edu/fa/parking/transportation/alternatives/bicycles,--,,--,--,,--,True,The NYS Pollution Prevention Institute at RIT publishes a semiannual newsletter highlighting its new initiatives and research.,http://www.rit.edu/affiliate/nysp2i/newsletters,True,University News publishes a bimonthly Institute-wide newsletter that includes at least one sustainability focused article in each edition.,http://www.rit.edu/news/storiesbytag.php?tag=athenaeum,True,"Rochester Institute of Technology has launched a publication dedicated to the study of environmental sustainability. The Journal for Environmental Sustainability has editorial staff from around the world and informational articles about understandings and trends within the field. It includes theoretical papers, applied research, case studies and commentaries by professionals in the field of environmental management",http://www.environmentalmanager.org/index.php/journal/,--,,--,--,,--,--,,--,--,,--,--,,--,--
Saint Louis University,2016-03-24,2016-03-24 17:18:14,bverhof1@slu.edu,2.0,Pursuing,**,True,The Office of Sustainability and Benchmarking website (greenbilliken.slu.edu) serves as a centralized sustainability hub for the campus community. The website features initiatives and programs implemented on campus along with events and news stories occurring in and around the campus. The website is regularly updated with new information and links to other departments and organizations on campus that focus on sustainability.,http://greenbilliken.slu.edu/,True,"Starting in 2014, the Office of Sustainability & Benchmarking began releasing a monthly SLUstainability newsletter to subscribers, in order to centralize sustainability communication on-campus. The newsletter features events and activities that occurred over the last month and is a resource for individuals about upcoming events. In addition, the newsletter features tips about how to implement sustainability into individuals' daily lives.",http://us9.campaign-archive1.com/home/?u=74adf539d41e32af7dde5d731&id=31491e85d1,True,"The Green Billiken (Office of Sustainability and Benchmarking) utilizes Facebook, Twitter, Instagram, and Pinterest to engage students, faculty, and staff about activities and events occurring on campus. It is also utilized to publicize the sustainability efforts of other departments and organizations.",http://greenbilliken.slu.edu/,True,"Student and faculty projects are highlighted on the Center for Sustainablity website, in the campus-wide Newslink, and in traditional research journals and conference proceedings. Additionally, students are encouraged to participate in the annual Graduate Student Association Research Symposium is held each year during the spring semester.",http://www.slu.edu/sustainability/research/faculty-research,--,"Facilities Services' Energy and Utilities Strategic Action Team is in the process of designing signage to highlight energy and utility strategies implemented in buildings around campus.
 
Currently, Facilities Services includes sustainable features of projects online. ",http://www.slu.edu/facilities-services-home/sustainability/campus-operations/buildings-and-grounds##1,True,"Fresh Gatherings Cafe on the Medical School campus provides information on the benefits of sustainable food systems. The cafe procures produce from local farmers year round. Names of the farms and the produce that they sell to the cafe are listed on the daily menu. (http://www.slu.edu/x19799.xml) 
 
The Universities dining vendor, DineSLU, offers students the ability to view online menus for vegan, vegetarian and other healthier options. In addition, the DineSLU nutritionist is available on campus to help verify information. DineSLU also provides information on their website about what they are doing on campus to make dining more sustainable. (http://slu.campusdish.com/Sustainability.aspx). 
 
DineSLU also updates menu screens dining locations featuring food information. These changes were made to increase the awareness about the menu options and clearly identify vegan, vegetarian and made without gluten items. These menu screens are a great visual representation of the menu options. For more specific nutrition information, go up to the station and look at the nutritional cards placed at each specific menu item. These cards provide more in-depth information on calories, fat, protein, sugar, sodium and more. For students following a gluten-free diet, look for the newly added Made-Without-Gluten station and little signs peppered throughout the other stations. (http://www.slu.edu/x100010.xml)",http://www.slu.edu/x100010.xml,True,"SLU maintains a pervious parking area, green roof, a native garden, rain barrel sites, a teaching orchard, and community urban garden. Some of these sites include signage and labeling. In addition, the Office of Sustainability and Benchmarking is working with the Grounds department to create signage at all these locations in addition to using signage when they use organic fertilizer in the flower beds further demonstrating their sustainable methods of practice.",http://www.slu.edu/facilities-services-home/sustainability/campus-operations/buildings-and-grounds,True,"In 2014, the Office of Sustainability and Benchmarking created a Campus Sustainability Map highlighting sustainability initiatives on campus. Some items included on the map are: solar arrays, exterior recycling bins, water bottle filling stations, native gardens, shuttle stops, public transit stops, bike paths, and much more. The map, which includes all three Saint Louis campus locations was updated in 2015 to include additional sustainable campus features. Some of these additions include a food service location certified by the Green Dining Alliance, a program based out of the local, non-profit St. Louis Earth Day and solar arrays.",http://www.slu.edu/Documents/facilities/Sustainability/Slu%20Sustainabilty%20Map.pdf,True,"Saint Louis University offers numerous options in traveling to and around campus.
 
A brief overview of transportation options available through SLU can be found on the transportation website, including information about programs such as carpooling, mass transit, and biking.",http://www.slu.edu/facilities-services-home/departments/transportation-services/transportation-options,True,"Although no navigation information is directly available, Transportation Services provides alternative transportation information on their website for students.  Information on the page  provides tips about bicycle/pedestrian safety provided by Bike St. Louis. In addition, the website provides a link to TrailNet which provides a resource for individuals to find the best routes in town as well as bicycle safety classes and resources.",http://www.slu.edu/facilities-services-home/departments/transportation-services/transportation-options,--,"With the opening of the newest residence hall on campus, there are additional opportunities to partner with Housing and Residence Life.  Incorporation of a Guide for Green Living would be a great tool for these new incoming students in the most sustainable hall on campus to date.",--,--,"The topic may be covered incidentally, but there is no regular and defined sustainability beat.  There are one or two articles or editorials in the student newspaper (The Unews) covering the topic of campus sustainability each year. Generally the coverage relates to new sustainability initiatives or closer examination of the effectiveness and viability of existing sustainability efforts. The below link will display articles containing sustainability via a simple search.",http://www.unewsonline.com/?s=sustainability,True,"Saint Louis University produces an annual Campus Sustainability report that highlights all the past year's sustainability efforts. Topics covered in the report include planning, academics, operations, engagement, and recognition. Written by the Office of Sustainability of Benchmarking, sustainability stories contributed to the report can be submitted by every department, student group, and/or individual.",http://www.slu.edu/facilities-services-home/about-us/annual-reports,True,"A postcard was produced in spring 2015 to promote SLU's sustainability efforts to university leaders across the country.

The postcard was a printed piece. It was not put online. ",--,True,"SLU's Spring 2015 alumni magazine carried the new sustainability chair appointment (pg. 6) and ""Green College"" rating (pg. 7). The summer issue of the magazine ran news of sustainability ratings (pp. 6-7). Other key SLU publications, including the undergraduate recruitment viewbook (pg. 25), mention SLU's commitment to sustainability efforts. 

The alumni magazines are http://www.slu.edu/Documents/universitas/universitas_spring2015.pdf 
and 
http://www.slu.edu/Documents/universitas/universitas_summer2015.pdf. 

The SLU viewbook can be found at: 
http://www.flipsnack.com/SLUadmission/slu-viewbook-15-16-ftul459mv.html",--,--,,--,--,,--,--,,--,--,,--,--,,--,--
San Francisco State University,2016-03-25,2016-03-25 17:34:58,kordesch@sfsu.edu,2.0,Pursuing,**,True,"The Office of Sustainability maintains a central website that serves as an introduction to sustainability activities at the university. It focuses on describing sustainability goals, data showing progress towards goals, and ways for the community to get involved through student groups, green teams, and events. ",http://sustain.sfsu.edu/,--,"SF State has a Sustainability email listserv for staff and faculty. Sustainability news is also included in the main campus newsletter, the Campus Memo. The Administration and Finance department newsletter includes a regular sustainability corner.  ",https://gateway.sfsu.edu/distributionlistsubscription,True,"The Office of Sustainability maintains Facebook, Twitter, and Instagram accounts that publicize events, highlight sustainable behavior, and educate the campus about sustainability. https://www.facebook.com/greensfsu, https://twitter.com/greensfsu, https://instagram.com/greensfsu/ ",https://www.facebook.com/greensfsu,True,Urban Planning students have started their own journal that focuses on student projects in Urban Planning.,http://dusp.sfsu.edu/content/urban-action-journal,--,,--,True,"Sodexo, the company that operates SF State's dining center publishes signage, digital screens, and brochures that highlight sustainable food choices, origins of their food, and information on decreasing food waste. ",http://housing.sfsu.edu/housing/content/dining-center,True,"SF State's Grounds department is cultivating a landscape that  maintains urban biodiversity, requires no irrigation with drinking water, and exports no green waste. Signage throughout campus teaches visitors about all the sustainable practices that are in place.",http://sustain.sfsu.edu/landscape,True,"SF State maintains print and digital copies of sustainability maps that allow visitors to find sustainable features on campus. 

http://sustain.sfsu.edu/content/librarys-landscape-learning-laboratory-5",http://sustain.sfsu.edu/content/sustainability-maps,True,"SF State maintains a transportation website that details how to take transit, carpool, walk, or bike to campus. The website is advertised throughout campus on buses and digital screens. ",http://parking.sfsu.edu/transit,True,"SF State maintains a portion of the Parking and Transporation website that focuses on bicycle commuters. Associated Students also has a bicycling page that highlights bicycle events and educational events. 

http://www.sfsustudentcenter.com/sustainability/",http://parking.sfsu.edu/biking,True,SF State publishes a green guide for residents and provides training each semester to resident assistants. ,http://sustain.sfsu.edu/sites/sites7.sfsu.edu.sustain/files/assets/doc/green_guide.pdf,True,"Each semester, a student reporter from the Golden Gate Xpress newspaper is assigned to the Environment/Sustainability beat. Coverage includes events, new sustainability initiatives, and investigations in to new sustainability opportunities. http://goldengatexpress.org/topic/office-of-sustainability/",http://goldengatexpress.org/topic/environment/,--,,--,--,,--,--,,--,--,,--,--,,--,--,,--,--,,--,--,,--,--
Santa Clara University,2016-02-26,2016-02-26 20:44:58,lkalkbrenner@scu.edu,2.0,Pursuing,**,True,"SCU's sustainability website is built upon the framework set by the University's Comprehensive Policy on Sustainability, and aligns with STARS. The website categorizes information into Take Action, Academics, Events and Programs (Student Life), Campus Operations, University Commitments and Policies, and About the Center for Sustainability.

The website also highlights the University's Climate Action Plan, service learning opportunities, FAQs, as well as upcoming events on campus and in the community. The website is a resource for students along with faculty and staff that helps foster a culture of sustainability throughout campus.",http://www.scu.edu/sustainability,True,"Santa Clara University's Center for Sustainability publishes a monthly ""Sustainability Update"" online, which is e-mailed to most students, faculty, and staff. The Sustainability Update highlights sustainability-related projects, news and events around campus, and throughout the community. The e-newsletter also profiles students, faculty and staff that go out of their way to promote sustainability, and offers tips and information on how to live more sustainably.",https://www.scu.edu/sustainability/takeaction/newsletter,True,"The Center for Sustainability maintains an online social media presence via Facebook, Twitter, Instagram, YouTube, and Pinterest.
Facebook: http://www.facebook.com/sustainablescu
Twitter: @SustainableSCU
Instagram: @SustainableSCU
YouTube: http://www.youtube.com/user/sustainabilityintern
Pinterest: http://www.pinterest.com/sustainablescu/",https://scu.edu/sustainability/about/socialmedia,True,"The Sustainability website houses student research from courses, fellowships, and the Sustainable Living Undergraduate Research Project.",https://scu.edu/sustainability/academics/research,True,"Signage is located in many venues across campus. The Commons at Kennedy Mall is SCU's sustainable design demonstration building. The Commons is a living lab that the University uses for classes, meetings, as well as a testing ground for sustainable components that may be used in upcoming projects. Signs throughout the building highlight the sustainable building features. Signage throughout campus indicate that landscaping is watered with recycled water. There are also informational signs near all waste bins (landfill, recycling, and compost).",https://scu.edu/sustainability/operations/buildings/design,True,"Throughout the Marketplace, SCU's main dining hall, Dining Services by Bon Appetit posts information about local agriculture and other ways diners can reduce their carbon footprint through the way they eat. Bon Appetit also provides brochures about their sustainable food initiatives, such as the Circle of Responsibility (Farm to Fork, In Balance, Low Fat, Organic, Seafood Watch, Vegan, Vegetarian, and Well-Being options).",https://scu.edu/sustainability/operations/food/,True,Signage throughout campus indicates that landscaping is watered with recycled water.,https://scu.edu/sustainability/operations/buildings/landscape,True,"The tour emphasizes efforts to maintain environmental justice and sustainability, highlighting some of the sustainability elements of Santa Clara University which contribute to the goal of being carbon neutral by the end of 2020. Stops include the Mission Church, Solar Decathlon houses (2007 and 2009 3rd place winners), the Forge Garden, the many alternative energy sources used on campus, and much more.",https://scu.edu/sustainability/takeaction/tour,True,The Sustainability website provides commuters with alternative transportation options. The Center for Sustainability has also created a number of videos highlighting sustainable commuting which were shared via social media.,https://scu.edu/sustainability/operations/transportation,--,,--,True,"Residence Life Sustainability Liaisons collaborate with the Center for Sustainability to further develop a culture of sustainability within Santa Clara University’s residential learning communities. A sampling of programs during the 2014-15 academic year include: hosting an event for the ""Zero-Power Hour ""in their residence hall during the Energy Challenge, creating sustainability-themed bulletin boards and sharing them with other Residence Life Sustainability Liaisons, organizing resident field trips to the local farmers' market, and organizing resident volunteer days at the campus garden.
https://scu.edu/sustainability/programs/liaisons/reslife/ ",https://www.scu.edu/sustainability/takeaction/resources/students/cf/,True,The campus weekly newspaper regularly features articles and opinion pieces about sustainability.,http://thesantaclara.org/,--,"""This Week at SCU"" is the weekly digital newsletter that the Associated Student Government Public Relations Vice President sends out to the entire student body. Each week there is a Sustainability News section featuring the ""Tips & Events of the Week"" that informs students about sustainability-related events happening on and off-campus, as well as behavior changes they can make to lead a more sustainable lifestyle. ",--,--,,--,--,,--,--,,--,--,,--,--,,--,--,,--,--,,--,--
Seattle University,2016-03-23,2016-03-23 11:54:18,thompson@seattleu.edu,2.0,Pursuing,**,True,"Seattle University's sustainability web site has information on campus operations, academics, the President's Committee for Sustainability and how to get involved on campus.",http://www.seattleu.edu/sustainability,True,The Center for Environmental Justice (CEJS) publishes its newsletter with an aim to keep readers up-to-date on Seattle University's environmental justice and sustainability efforts.,https://www.seattleu.edu/cejs/newsletter/,True,"The CEJS administers a Facebook page to keep campus members up-to-date on local events, learning opportunities, jobs, educational competitions, and new campus initiatives.",https://www.facebook.com/envjustice,True,"The Center for Environmental Justice and Sustainability awards 5-6 fellowships annually for student research related to sustainability. Over the course of the academic year, students are required to present their progress at three gatherings via poster boards. Each students' research is initially described on the CEJS web site. ",https://www.seattleu.edu/cejs/fellowships/students/,True,The 4 LEED Gold buildings each have a large interpretive sign in front to explain the green building strategies used.,http://www.seattleu.edu/sustainability/what-su-is-doing/buildings/,True,Bon Appetit has computer display with information on how and why they source sustainable food and how people can eat more sustainably.  Bon Appetit also has table tents that describe their sustainability efforts on dining tables.,http://su.cafebonappetit.com/curious/,True,"The Biodiversity Garden has an educational sign explaining a variety of principles used to increase local biodiversity, including displays of plants that attract beneficial insects and birds, shade tolerant native plants that are good alternatives for other ground covers (such as ivy), and the benefits of mulching and composting for increasing soil biodiversity.  The Lee Miley Rain Garden has an educational sign explaining its purpose, benefits, and how it functions.",http://www.seattleu.edu/sustainability/what-su-is-doing/landscape/,True,"The Seattle University Campus Edibles Map is a self-guided walking tour of 11 campus locations where fruits, vegetables and herbs are integrated into the landscape for campus members and the public to pick and eat.",http://www.seattleu.edu/grounds/edibles/,True,"The Transportation and Parking Services web site has information on: all the incentives available to campus members on how to take alternative transportation to campus, links to 3 online transit planners, Seattle bike maps and safe routes and how to register your bike.",http://www.seattleu.edu/transportation/,--,"http://www.seattleu.edu/transportation/biking/

http://www.seattleu.edu/transportation/Commuter/walkers/
",--,--,,--,--,,--,--,There is a Seattle University sustainability Facebook page.,http://www.facebook.com/envjustice,--,,--,--,,--,--,,--,--,,--,--,,--,--,,--,--,,--,--
Sewanee - The University of the South,2016-02-10,2016-02-10 09:31:47,mpate@sewanee.edu,2.0,Pursuing,**,True,"Sewanee recently reworked their Sustainability website in late 2013. The new site has links about Energy and Climate, Natural and Cultural Stewardship, Food and Dining, and Buildings. ",http://sustain.sewanee.edu/,--,No sustainability newsletter exists at this time.,--,True,The Office of Environmental Stewardship and Sustainability maintains an active presence on Facebook (Sustain Sewanee) and Twitter.,https://www.facebook.com/pages/sustain-sewanee/213955726088,True,"Sewanee has two means by which student research on sustainability is being disseminated.
1) Scholarship Sewanee—an annual afternoon-long presentation for all students to display their research from the academic year, answering questions, and arguing points with faculty and students. Sustainability research is often a large portion of the research completed.

2) The Office of Environmental Stewardship and Sustainability often displays student research on the Domain Research page of Sustain Sewanee webpage.",http://sustain.sewanee.edu/group/cat/domain,--,Sewanee does not have such signage at this time.,--,--,No such signage or brochures exist at this time.,--,--,No such signage exists at this time.,--,True,"The OESS and the Admissions Office are currently in the process of creating a sustainability walking tour which will highlight some of the important places on campus relating to sustainability including Spencer Hall (where the OESS resides), Snowden Hall (home to our solar system), the herb garden outside of McClurg Dining Hall, Abbo's Alley and the University Farm. The tour should be available to students for Fall 2013.",--,--,No guide for commuters exists at this time.,--,--,No navigational or educational tools exists for bicyclists and pedestrians at this time.,--,--,"No such guide exists at this time, although there is one currently being produced. ",--,True,"Although there is not a designated column or reporter assigned to sustainability in the student newspaper, the Sewanee Purple, sustainability has had at least one article in almost all of the editions of the paper in 2014-2015. ",http://thesewaneepurple.org/,True,"in Spencer Hall, the Biology and Environmental Science building, there are electronic boards that display research, facts, information, and other information the OESS wishes to publish and convey to visitors on campus. The boards lie strategically along the main tour route operated by Admissions.",--,--,,--,--,,--,--,,--,--,,--,--,,--,--,,--,--,,--,--
