Fort Lewis College,2016-03-27,2016-03-27 16:01:16,kehilimire@fortlewis.edu,2.0,Pursuing,**,True,"The Fort Lewis College Sustainability website contains an overview of sustainability at Fort Lewis College, including an inventory of sustainability projects and initiatives, information about governance, and a resource of courses and research with sustainability components.",https://www.fortlewis.edu/sustainability/,True,"The Fort Lewis College Environmental Center publishes a bi-weekly electronic newsletter, the EC Digest, which contains information about Environmental Center events and initiatives, highlights on student sustainability experiences and learning, features of the Environmental Center's Environmental Library, and a link to community sustainability events.",https://www.fortlewis.edu/environmentalcenter/ECDigest.aspx,True,"The Fort Lewis College Environmental Center manages a Facebook Page, Blog, Instagram account, and photostream that all highlight the Environmental Center's sustainability efforts both on campus and in our community",https://www.fortlewis.edu/environmentalcenter/,True,The Fort Lewis College Library maintains a webpage that contains an archive of student research related to sustainability on campus,http://subjectguides.fortlewis.edu/ENVS,True,All LEED buildings have signage that indicate their 'green' features and direct building users towards ways to participate in helping to promote sustainability on campus.,https://www.fortlewis.edu/Home/About/Sustainability.aspx,True,"In 2015, the Fort Lewis College Environmental Center and Sodexo received a grant to create educational signage and labeling materials to 1) showcase that FLC is a Real Food Challenge signatory, 2) help diners understand the value behind the Real Food Challenge movement and 3) provide diners with the ability to identify and selectively choose 'real' foods. To this end, we have permanent signage installed in all campus dining locations, a 30x40' art installation in the college dining hall, published 'menus' of real foods, digital signage of 'real' foods, food labeling, as well as, an informational website.",https://www.fortlewis.edu/environmentalcenter/OurPrograms/RealFoodChallenge.aspx,True,The 'native' landscapes located outside of the Student Union and the Native Plants Garden located behind Berndt Hall have signage explaining why these zones look 'wild' and how they benefit pollinators and conserve water.,--,--,,--,True,"The Fort Lewis College Student Life webpage contains information about the Durango Transit system, for which staff receive discounted passes and students receive free passes. Bus route and bIke maps are always available at the Student Information Desk in the Student Union, as well as in the Environmental Center.",https://www.fortlewis.edu/Home/StudentLife/AboutDurango.aspx,--,,--,--,,--,--,,--,--,,--,--,,--,--,,--,--,,--,--,,--,--,,--,--,,--,--,,--,--
Furman University,2016-02-22,2016-02-22 13:43:13,yancey.fouche@furman.edu,2.0,Pursuing,**,True,"Furman's sustainability website shares information about the university's sustainability efforts in areas such as academics and curriculum, student engagement, and implementation of the sustainability master plan. It also provides resources on sustainability for the Furman community.

",http://www.furman.edu/sustain,True,The Shi Center of Sustainability releases a newsletter to the furman community and public community that have signed up to receive the newsletter email.,http://www.furman.edu/academics/shicenter/Media/Pages/default.aspx,True,The Shi Center for Sustainability at Furman University hosts a Facebook page that provides information about sustainable initiatives both on and off campus.  The page also promotes a more sustainable lifestyle by encouraging viewers to participate in activities such as eating locally and biking on the local Swamp Rabbit Trail. ,https://www.facebook.com/ShiCenter,True,"Furman Engaged celebrates the wide variety of undergraduate research, scholarship and creativity of our undergraduates.This annual event brings our campus community and visitors together for a day of presentations, posters and performances across Furman's campus. Our students present topics from a range of disciplines, from research in the sciences and humanities to creative works in the fine arts Topics include research in sustainability.",http://www.furman.edu/sites/FurmanEngaged/Pages/Default.aspx,True,"Building signage is utilized specifically in LEED buildings to highlight specific green building features on campus.  A central sign is posted in one of the LEED buildings to explain the rating system of LEED and how these features are sustainable.  Additionally, smaller signs are placed around the building to highlight specific features.  For example, these signs are located near the bike racks to highlight alternative methods of transportation and near the water fountains to feature water use reduction.      ",--,True,"The Dinning Hall displays signs and brochures to highlight sustainable initiatives such as utilizing local and sustainable products when available and composting 100% of post-consumer waste at the Furman Farm.  Additionally, the Dining Hall provides two theme meals per year focused on sustainably sourced foods (Local and Organic Meal Day); these two meals are an occasion to provide additional signage and information about the food offered by the Dining Hall, as well as an opportunity to provide the most locally or organically sourced food possible.     ",--,True,"Furman's Planning and Grounds Department, in collaboration with faculty members, students, and the Shi Center for Sustainability, has been heavily engaged in a restoration project for Furman Lake, the 30 acre manmade lake at the center of campus. As part of the restoration project, signs are posted to share information about the no-mow areas, native plantings, and rain gardens that have been implemented around the lake area. The National Fish and Wildlife Foundation provided three signs, in cooperation with Upstate Forever (a local non-profit) and Furman University. Brochures are also available to provide additional information and direct visitors and community members to the lake restoration project website.",--,--,Furman's admissions office distributes a flyer that marks all of Furman's sustainability initiatives. The color and numbers correspond with locations on the Furman campus map that is also distributed to visitors.,--,--,,--,True,"The University Police Department provides brochures about bicycle tips to help ensure the safety of cyclists.  These tips include advice on how to lock the bike, utilize hand signals, and wear proper safety equipment.  ",--,True,"The Shi Center created a Student Guide to Sustatinability at Furman. 
Furman's Green Guide for students provides information on how students can live and act more sustainably on campus; information on getting engaged in sustainability-oriented co-curricular activities on campus; information on curricular options for sustainability; and information on engaging in the Greenville community with sustainability and the environment. The Green Guide was developed by students, to meet the needs of the student community at Furman.The guide includes recommendations on how to conserve energy and what can be recycled.",--,--,,--,True,"The Green Scene at Furman is a blog maintained by the Sustainability Outreach and Engagement Fellow.  The blog is updated regularly with Furman sustainability news, information about Furman and community events, summaries of student research and work experience, and other material written by the Fellows.  This blog is targeted to the student population to help engage and inform fellow students.",--,--,,--,--,,--,--,,--,--,,--,--,,--,--,,--,--,,--,--
George Washington University,2016-02-29,2016-02-29 13:04:33,shannonross@gwu.edu,2.0,Pursuing,**,True,The GW Office of Sustainability maintains a central website with all of the information about the university's sustainability efforts. ,http://www.sustainability.gwu.edu/,--,,--,True,"The Office of Sustainability regularly updates both a Facebook and Twitter page with updates on sustainability at GW and tips on how to be more sustainable. Both pages have many followers consisting of GW students, staff, and more.",https://twitter.com/SustainableGW,True,"Planet Forward is a multi-media platform for dissemination of student views and research.  The George Washington Journal of Energy and Environmental Law Journal provides a forum for student voices and research.  The Policy Perspectives Journal of the Trachtenberg School of Public Policy and Administration publishes student research, including on topics of sustainability.  

Each spring, the Office of the Vice President for Research sponsors a two-day ""Research Day"". Faculty and graduate students in the School of Public Health are featured on the second day.  On the second day, undergraduates and graduates from the other GW schools present their research in a day-long illustrated poster session. Winners are chosen from each school at both undergraduate and graduate levels.   Many students who participate are engaged in sustainability research.  In 2014, for example, 6 sustainability minors presented posters.  Sustainability minor Jesse Schaeffer won the research prize for the Elliot School of International Affairs for his research on food sustainability among Syrian refugee populations in Jordan.",http://research.gwu.edu/research-days-2016,True,"For new LEED buildings on campus, GW incorporates signage and tours in the buildings to help educate the community about the relevant green features. ",http://sustainability.gwu.edu/green-building,True,"Information is provided in the central dining facility (J Street) about the local sourcing of products. There is also on-site promotion of Meatless Mondays at J Street throughout the academic year.

In addition, information about GW's partnership with the primary food vendor, Sodexo, can be found on the sustainability website.
",http://sustainability.gwu.edu/food-dining,True,"GW's campus features a green space known as the Square 80 Plaza. Previously a parking lot, this 3/4 acre green space, in the midst of GW’s densely built downtown Washington, DC, campus, provides a green respite and uses water reclamation technology to capture and reuse storm water on the site. Sustainable grounds-keeping strategies employed on this site include rain barrels, sunken tree beds, permeable pavers, rain gardens and a network of cisterns. The site features powerful and visually striking signage that helps communicate the university's sustainability vision and the techniques employed on the site. 

As GW implements its Ecosystems Enhancement Strategy, one of the areas for expansion will be additional signage about other sustainable landscaping techniques employed. It is important to note that due to GW's unique location in the middle of downtown Washington, DC, at times additional signage placement is difficult due to zoning and public-space constraints and regulations. ",--,True,"The Office of Sustainability has a green tour that it offers to interested parties. Due to the rapidly changing nature of the GW campuses and diversity of tour requests, there is no standard write-up of this tour, but students are trained in the script by Office of Sustainability staff. Additionally, the tour guides on campus incorporate sustainability into their year-round tours for prospective students. 

GW has a map of sustainable features of campus, which is used for new student orientation in the summer as well as other purposes. The features include Green Roofs, Solar Thermal displays, bikeshare stations on campus, and much more. The map is also posted on the Office of Sustainability's website, and is showcased through many channels on campus.",https://sustainability.gwu.edu/sites/sustainability.gwu.edu/files/downloads/Sustainability_Tour_2015.pdf,True,"The guide for commuters features many of the alternative methods of transportation available to the GW community including Metro, bus routes, ZipCar, Capital Bikeshare, car2go, carpools and shuttle services. ",http://sustainability.gwu.edu/transportation,True,"In all large new construction on campus GW is offering transportation kiosks to promote the diverse transportation options available to the GW community. In the Science and Engineering Hall the kiosk offers real-time transportation data, allowing the users to identify the most efficient method of transportation, including bicycling and walking. ",--,True,"GW features guidelines for green living and incorporating sustainability into the residential experience on its sustainability website. Student Eco-Reps conduct peer-to-peer education in the residence halls helping to disseminate information to students. Training is also conducted with Resident Assistants on campus to help them understand sustainable living and pass the information along to their students. 

Sustainability is featured in the new student orientation in several ways. As one example, the Office of Sustainability includes information on the beds of all the students about recycling, water and electricity while they are on campus. 
",http://living.gwu.edu/green-living,True,"The GW Hatchet regularly covers sustainability news on campus in its bi-weekly publications. The Office of Sustainability communicates with reporters to answer questions about sustainability at GW, which results in regular stories and blog posts in the student newspaper. ",http://sustainability.gwu.edu/news-archive,True,"In 2012 GW released its first sustainability report. This prospectus provides an overview of the university's sustainability progress to date, and updates on projects. The report features inserts highlighting GW's schools and their sustainability academic offerings. ",http://issuu.com/sustainablegw/docs/sust_brochure_final,True,"The university's internal news magazine, GWToday, profiles sustainability progress frequently. A sampling of past stories can be found in the link below. The university has a Twitter account, a Facebook page and a Green Alumni listserv and facebook page.",http://sustainability.gwu.edu/news-archive,True,"The GW Law Sustainable Energy Initiative Update is a newsletter written by Donna Attanasio the Senior Advisor for Energy Law Programs at the George Washington University Law School. It contains news, future events, and suggested readings on sustainable energy topics.",--,True,"The Green Alumni Network was begun in 2009 and has over 700 members worldwide and  450+ in the D.C. Metropolitan area. The Network has a Facebook page, a LinkedIn page: http://www.linkedin.com/groups?gid=2072112&home=
and a website (see website URL field).

Also, the @SustainableGW Twitter feed has over 3,900 followers and @GWFoodForce and @gwsolar both have over 500 followers. They provide regular communications about sustainability issues on campus as well as events.

The Alumni in Energy has 200+ members currently and has an Alumni in Energy Facebook group, as well as an Alumni in Energy LinkedIn group:
http://www.linkedin.com/groups?home=&trk=my_groups-tile-grp&gid=4245509
and an Alumni in Energy website: http://alumni.gwu.edu/alumni-energy-association
",http://alumni.gwu.edu/green-alumni-network,True,"GW published its Ecosystems Enhancement Strategy in 2012 and it is available on the website. The plan incorporates input from stakeholders inside and outside of the university, and reflects their aspirations for sustainable development locally, regionally, and globally. The publication discloses the university's goals and targets for carbon, water, food, waste, and natural space, and proposed tactics to reach those goals and targets. The purpose of sharing the documents publicly is to increase transparency and accountability for the university with its stakeholders. ",https://sustainability.gwu.edu/sites/sustainability.gwu.edu/files/downloads/GW%20Ecosystems%20Enhancement%20Strategy%202012.pdf,True,"GW published its GWater Plan in 2011 and it is available on the website. The plan incorporates input from stakeholders inside and outside of the university, and reflects their aspirations for sustainable development locally, regionally, and globally. The publication discloses the university's goals and targets for water conservation, and proposed tactics to reach those goals and targets. The purpose of sharing the documents publicly is to increase transparency and accountability for the university with its stakeholders. ",https://sustainability.gwu.edu/sites/sustainability.gwu.edu/files/downloads/GWater%20Plan.pdf,True,"GW published its Climate Action Plan in 2010 and it is available on the website. The plan incorporates input from stakeholders inside and outside of the university, and reflects their aspirations for sustainable development locally, regionally, and globally. The publication discloses the university's goals and targets for greenhouse gas reductions, and proposed tactics to reach those goals and targets. The purpose of sharing the documents publicly is to increase transparency and accountability for the university with its stakeholders. ",https://sustainability.gwu.edu/sites/sustainability.gwu.edu/files/downloads/GW%20Climate%20Action%20Plan.pdf,--,,--,--
Georgia College & State University,2016-03-25,2016-03-25 19:10:06,doug.oetter@gcsu.edu,2.0,Pursuing,**,True,"Our website hosts annual reports, special reports, council goals & meeting minutes, sustainability data, and links to many more campus and community efforts.  We use an external site for our blog and Facebook/Twitter/Instagram feeds.  The site is updated regularly.",http://www.gcsu.edu/green,--,,--,True,"SC Facebook page: https://www.facebook.com/GCgogreen 
SC Twitter: https://twitter.com/GC_Go_Green 
SC Instagram: https://instagram.com/GC_Go_Green 
",https://gcgreen.wordpress.com/,True,"The Sustainability Council website hosts pages for the Sustainability Fee Project, a student initiative to improve campus sustainability through research projects.  Each project is required to produce final assessments and reports, which are shared on the site.",http://old.gcsu.edu/green/projects.htm,True,We have LEED plaques in our Wellness Center (applying for LEED Silver).  Recycling signage is in place across campus in buildings and residence halls.,http://old.gcsu.edu/wellness/facilityfeatures.htm,True,"Sodexo provides several sustainability messages in a variety of ways, including web, table inserts, posters, and flyers.",http://www.sodexousa.com/usen/citizenship/sustainability/sustainability.asp,--,,--,--,,--,True,We have web resources to promote carpooling and shuttle busing. ,http://old.gcsu.edu/green/transportation.htm,True,Georgia College was recently named a 'Bike Friendly University' and have added multiple encouragements for bikers.  We are developing a resource page for our Parking & Transportation department.,https://frontpage.gcsu.edu/announcement/georgia-college-named-bronze-bicycle-friendly-university,True,Presentations are made to incoming and continuing residents.,http://old.gcsu.edu/housing/green.htm,True,We have a reporter for the student paper who is assigned to write articles for sustainability projects.,http://www.gcsunade.com/?s=sustainability,True,We are required to produce an annual report documenting the efforts and accomplishments of the Sustainability Council.,http://old.gcsu.edu/green/reports.htm,--,,--,--,,--,--,,--,--,,--,--,,--,--,,--,--,,--,--
Gonzaga University,2016-02-29,2016-02-29 13:09:28,simonj@gonzaga.edu,2.0,Pursuing,**,True,"The website provides a section defining sustainability at Gonzaga University along with links to partners in stewardship and sustainability. A Recycling @ GU page provides information on the dos and don'ts of recycling on campus. The Campus Sustainability Initiatives page breaks initiatives down by departments and projects. A Council page gives information on the structure, purpose, and activities of the Advisory Council on Stewardship and Sustainability. The News page provides links to sustainability news published since 2008. An Academics & Research page provides contacts and information on sustainability in the curriculum as well as research opportunities. The Stewardship page outlines our catholic responsibilities regarding sustainability, and the Contact Us page has information for contacting sustainability officials around campus.",http://www.gonzaga.edu/sustainability,True,Members of the Gonzaga community can subscribe to a sustainability listserv to receive periodic email updates on sustainability efforts around Gonzaga. Information is also posted to a facebook page.,https://www.facebook.com/SustainabilityAtGonzaga,True,facebook page and twitter account,https://www.facebook.com/SustainabilityAtGonzaga,True,The Gonzaga Bulletin provides an online and in-print vehicle for student submissions of all kinds. This is the main resource for the News section on the Gonzaga Sustainability website.,http://www.gonzagabulletin.com/site/forms/,--,PACCAR?,--,True,"Sodexo's commitments for a better tomorrow include reducing carbon and water footprints, promoting healthy eating and living choices, providing local and sustainable food options, promoting community and world-wide sustainability efforts and research, reducing waste and promoting composting, as well as much more. Goals are displayed graphically in banners around the dining hall. Information is also available in brochures at various Sodexo locations around campus.",http://www.zagdining.com/sustainability/index.html,--,,--,--,,--,True,"At Gonzaga University, we have made a commitment to fully support and participate in the Commute Trip Reduction (CTR) program that is mandated by Washington State Law. More importantly, CTR will help our community by improving air quality and reducing traffic congestion. Program elements are outlined in a webpage along with links to brochures and pages with additional information about means and benefits of commuting sustainable. ",http://www.gonzaga.edu/campus+resources/offices+and+services+a-z/Human+Resources/Benefits/Work-Life/CommuteTripReduction.asp,--,,--,--,,--,--,,--,--,,--,--,,--,--,,--,--,,--,--,,--,--,,--,--,,--,--,,--,--
