Institution,Date Submitted,Last Updated,Liason Email,Version,Status,Does the institution produce the following outreach materials and/or publications that foster ...,Does the institution have a central sustainability website that consolidates information about the ...,A brief description of the central sustainability website,The website URL for the central sustainability website,Does the institution have a sustainability newsletter?,A brief description of the sustainability newsletter,The website URL for the sustainability newsletter,"Does the institution have social media platforms (e.g. Facebook, Twitter, interactive blogs) that ...",A brief description of the social media platforms that focus specifically on campus sustainability,The website URL of the primary social media platform that focuses on sustainability,Does the institution have a vehicle to publish and disseminate student research on sustainability?,A brief description of the vehicle to publish and disseminate student research on sustainability,The website URL for the vehicle to publish and disseminate student research on sustainability,Does the institution have building signage that highlights green building features?,A brief description of building signage that highlights green building features ,The website URL for building signage that highlights green building features ,Does the institution have food service area signage and/or brochures that include information about ...,A brief description of food service area signage and/or brochures that include information about ...,The website URL for food service area signage and/or brochures that include information about ...,Does the institution have signage on the grounds about sustainable grounds-keeping and/or ...,A brief description of signage on the grounds about sustainable groundskeeping and/or landscaping ...,The website URL for signage on the grounds about sustainable groundskeeping and/or landscaping ...,Does the institution have a sustainability walking map or tour?,A brief description of the sustainability walking map or tour,The website URL of the sustainability walking map or tour,Does the institution have a guide for commuters about how to use alternative methods of ...,A brief description of the guide for commuters about how to use alternative methods of ...,The website URL for the guide for commuters about how to use alternative methods of transportation,Does the institution produce navigation and educational tools for bicyclists and pedestrians? ,A brief description of the navigation and educational tools for bicyclists and pedestrians,The website URL for navigation and educational tools for bicyclists and pedestrians,Does the institution have a guide for green living and incorporating sustainability into the ...,A brief description of the guide for green living and incorporating sustainability into the ...,The website URL for the guide for green living and incorporating sustainability into the ...,Does the institution have regular coverage of sustainability in the main student newspaper (either ...,"A brief description of regular coverage of sustainability in the main student newspaper, either ...","The website URL for regular coverage of sustainability in the main student newspaper, either ...",Does the institution produce another sustainability publication or outreach material not covered ...,A brief description of another sustainability publication or outreach material not covered above ...,The website URL for this material (1st material),Does the institution produce another sustainability publication or outreach material not covered ...,A brief description of this material (2nd material),The website URL for this material (2nd material),Does the institution produce another sustainability publication or outreach material not covered ...,A brief description of this material (3rd material),The website URL for this material (3rd material),Does the institution produce another sustainability publication or outreach material not covered ...,A brief description of this material (4th material),The website URL for this material (4th material),Does the institution produce another sustainability publication or outreach material not covered ...,A brief description of this material (5th material),The website URL for this material (5th material),Does the institution produce another sustainability publication or outreach material not covered ...,A brief description of this material (6th material),The website URL for this material (6th material),Does the institution produce another sustainability publication or outreach material not covered ...,A brief description of this material (7th material),The website URL for this material (7th material),Does the institution produce another sustainability publication or outreach material not covered ...,A brief description of this material (8th material),The website URL for this material (8th material),Public Notes
Albion College,2016-02-25,2016-02-25 15:19:08,mfrever@albion.edu,2.0,Pursuing,**,True,"It’s about the food we eat.
The water we drink. 
The shelter we live in. 
The energy we use. 
The footprint we leave. 
And the future we build.",http://www.albion.edu/about-albion/sustainability,True,The news can be found in a blog form on the college website. ,http://www.albion.edu/about-albion/sustainability/sustainability-news,--,Facebook pages for the Center for Sustainability and the Environment; the Student Farm; the Whitehouse Nature Center.,--,--,,--,True,The Science Complex has brochures at the entrances to explain the LEED systems in the building. ,http://www.albion.edu/about-albion/sustainability/departmental-initiatives/science-complex,True,"The cafe, run by Bon Apetite has fresh signage at tables and thoughout the cafe. ",http://www.albion.edu/student-life/dining-services,--,,--,--,,--,--,,--,True,"Maps are available to suggest areas of interest and bike trails. Signs are posted at the Kellogg Center, Downtown and at Wesley Hall.",http://www.albion.edu/about-albion/sustainability/student-initiatives,--,,--,--,,--,--,,--,--,,--,--,,--,--,,--,--,,--,--,,--,--,,--,--,,--,--
Allegheny College,2016-03-29,2016-03-29 08:54:14,kelly.boulton@allegheny.edu,2.0,Pursuing,**,True,"The Sustainability Initiatives webpages address our campus commitments, accomplishments, community partnerships, academic opportunities, a student blog of sustainability efforts/events and a Daily Sustainability for Green Gators page focused on what faculty, staff and students can specifically do on a day to day basis to support and further sustainability efforts through their own actions.",http://sites.allegheny.edu/green/,--,,--,True,"Allegheny sustainability is active on Facebook, Instagram and Twitter. Besides posting about events and campus activities, we have an ongoing ""sustainability conversations"" series which highlights different campus members' pics and thoughts each week.
In addition to general sustainability pages, there are also specific Facebook pages for the Allegheny College BikeShare, Students for Environmental Action and Food Rescue.",https://www.facebook.com/pages/The-Green-Gator-at-Allegheny-College/252077571513781,True,"We use our social media pages to highlight interesting projects, including student research.  The Environmental Science department also compiles an online database of senior comprehensive projects, many of which focus on sustainability issues. We also have a monthly email that highlights student and faculty research.",http://sites.allegheny.edu/envsci/student-research/,True,Carr Hall in particular features extensive signage throughout to highlight green features ranging from building materials to daylighting to aquaponics.,--,True,"Our dining service provider, Parkhurst, offers signage, brochures and a website highlighting their efforts to support sustainable food systems through the FarmSource program and their Green Standards.  Additional signage explains our reusable takeout program, trayless dining program, comprehensive composting program and use of campus grown produce in board meals.",http://www.diningallegheny.com/index.php?id=172,True,"Several signs illuminate our on-campus gardens, comprehensive composting program and organic turf management efforts.",http://alleghenysustain.weebly.com/landscaping.html,True,"Allegheny offers a green tour of campus which includes guided tours by the sustainability coordinator and trained students, a self-guided tour brochure, and an online ""tour"" of campus sustainability stops.  Admissions offers this tour regularly to prospective students and various classes, reunion gatherings, and community groups request a green tour throughout each year.",http://alleghenysustain.weebly.com/index.html,True,"All students can ride all local transportation routes, including a student specific loop, for free with their ID cards.  Information on routes and the text feature is provided by the student government.",http://asg.allegheny.edu/home/student-li/the-loop,--,,--,True,"A full page highlights sustainability info in the Guide to Residence Life.  Content briefly highlights college commitments, energy consumption, and waste minimization, particularly recycling and composting.",https://allegheny.edu/admissions/incoming/GuidetoResLife0910.pdf,True,"There is always regular sustainability content and, depending on the year, sometimes a particular student is also assigned to the ""sustainability beat"".  Additional reporters also write about sustainability issues and efforts.",http://alleghenycampus.com/,True,"Gator Green blog: students can submit posts about sustainability initiatives, efforts, events.",http://sites.allegheny.edu/greengator/,True,Green Gator Twitter,https://twitter.com/#!/alleghenygreen,True,Green Gator Instagram,http://instagram.com/alleghenysustainability,True,"The Admissions department highlights campus sustainability efforts on their pages for prospective students and families, mentions sustainability efforts on their tours, and gives a sustainability fact sheet to every prospective student. ",http://sites.allegheny.edu/admissions/allegheny-distinctions/thinking-green-being-green/,--,,--,--,,--,--,,--,--,,--,--
American University,2016-03-23,2016-03-23 14:22:22,meganzl@american.edu,2.0,Pursuing,**,True,"The sustainability website includes information about campus greening related to the categories of: buildings, dining, energy & climate, grounds, purchasing, recycling, composting and waste, transportation, and water. The website also covers community greening, commitments & policies, education & research, how to get involved, and information about the office and staff.



",http://www.american.edu/sustainability,True,The sustainability newsletter is a publication of the Office of Sustainability containing timely updates about projects and initiatives carried out on campus as well as links to news stories online. ,http://www.american.edu/finance/sustainability/Newsletter.cfm,True,"The Office of Sustainability and Zero Waste initiatives both utilize twitter, facebook, and instagram to educate the community, share best practices, and communicate events and initiatives related to sustainability on and off campus. Additionally, the Student Sustainability Educators maintain a blog on Tumblr dedicated to GreenAU updates, events, and general sustainability topics. ",https://www.facebook.com/GreenAU/,--,n/a,--,True,"Info-monitors display sustainability stats in most buildings, including utility consumption as well as key campus sustainability features. Stickers on light switches across campus remind users to turn out the lights. Signs on paper towel dispensers remind users to conserve because paper comes from trees. Stickers on restroom waste bins instruct users that paper towels are composted so users should be careful not contaminate the bins. Plaques in building lobbies inform about green roofs. ",http://www.american.edu/finance/sustainability/Buildings.cfm,True,Signs in the Terrace Dining Room promote local food options and vegetarian meals.,http://www.american.edu/finance/sustainability/Dining.cfm,--,n/a,--,True,"A campus map identifies sustainability features as well as academic sustainability programs. Office of Sustainability staff and Student Sustainability Educators also offers tours to any groups that are interested. Past tours have been given to classes, campus offices, student groups, State Dept visitors, and K-12 students. ",https://www.american.edu/finance/sustainability/map.cfm,True,The sustainable transportation web page lists and links to alternative methods of campus transportation.,http://www.american.edu/finance/sustainability/Transportation.cfm,--,n/a,--,--,n/a,--,True,The Eagle regularly covers sustainability. Student Sustainability Educators and members of sustainable student organizations regularly contribute op-ed content. The student newspaper publishes daily content online and sends a weekly digest to the whole campus community.,http://www.theeagleonline.com/,True,Zero Waste Brochure to highlight the Zero Waste commitment of AU and educate students and staff about correct waste diversion. ,http://www.american.edu/finance/facilities/ZeroWasteResources.cfm,True,AU Sustainability List Serv - all members of the community are invited to share information about sustainability with the list. It is most frequently used to share information about upcoming events. ,http://listserv.american.edu/cgi-bin/wa?A0=AUSUSTAINABILITY-L,True,The entire campus is a certified arboretum and a brochure and book both provide information about the arboretum's history and associated organizations. ,--,--,n/a,--,--,n/a,--,--,n/a,--,--,m/a,--,--,n/a,--,--
Appalachian State University,2016-02-01,2016-02-01 13:37:33,balllf@appstate.edu,2.0,Pursuing,**,True,"The university's sustainability website strives to be a clearinghouse for all things sustainable within the university: academic and research offerings, events, news (local and regional) student involvement, and sustainability initiatives, both institutional and student-based.",http://sustain.appstate.edu/,--,,--,True,"The Office of Sustainability has a dedicated communications officers who is responsible for coordinating and updating social media platforms of Facebook, Instagram, and Twitter. These outlets allow for the office to reach a broader range of students and the community and provide real-time updates and reminders of events and opportunities related to sustainability at Appalachian State.",https://www.facebook.com/sustainAppalachian,True,"Annually, Appalachian hosts the Celebration of Student Research and Creative Endeavors.  The Celebration showcases and encourages meaningful research in all disciplines by undergraduates and graduate students at Appalachian. Last year (2013), over 100 students representing over 20 departments presented their results in either a performance, platform talk, or poster.",http://osr.appstate.edu//present-publish/celebration-student-research-and-creative-endeavors,True,"Appalachian's student union features signage regarding reduced water flow on its sink faucets and signage about the dual flush toilets.  There is also signage at the special items recycling area indicating special items.  At the water bottle refilling station, signage indicates the importance of reusing a water bottle.  On the paper towel dispensers, ""These Come from Trees"" stickers are displayed.  The student union is home to a large sustainability board available for students, faculty and staff to display material and information. The student union also hosts the Renewable Energy Initiative information kiosk, displaying information about all the renewable energy projects on campus.",http://studentunion.appstate.edu/pagesmith/64,True,"Appalachian Food Services created a flier about ways in which Food Services has gone ""green"".  Reduce, reuse, recycle is the theme of the flier.  Signage is in place at every dining facility on campus asking patrons for their support of campus sustainability initiatives.  The signs make recommendations for doing so, like bring your own cup/mug and recycles bottles here.",http://www.foodservices.appstate.edu/sustainability-documents,--,,--,True,"The walking map/tour is a virtual map. It was designed by a student in 2010. Sustainable Strides is designed to communicate not only about physical locations of sustainable activities/measures, but also about sustainable technology and or commitments.",http://sustain.appstate.edu/strides,True,"On the university's sustainability website, there is a page dedicated to alternative transportation at Appalachian. Listed is information about mass transit, ridesharing, car sharing, biking and motor pool. The guide for Sustainable Living for students, developed by the Office of Sustainability, includes information about mass transit and bicycling and encourages students to consider these options.

",http://sustain.appstate.edu/transit,True,"The University Outdoor Programs office organizes educational events, rallies, and both local and out of town bicycling trips for bicyclists. They also provide maps of various bicycle trails throughout the region.

Outdoor Programs has teamed up with the Office of Sustainability to promote alternative methods of transportation, such as bicycling, by providing safety education material and by funding and maintaining free ""bike repair stations"" at several locations on campus in an attempt to foster more non-vehicle commuters.",http://op.appstate.edu/bike-app,True,"The Office of Sustainability has developed a guide for student green living, which seeks to develop sustainable behaviors for sustainable living while in college and transferable beyond college.  The guide displays tips regarding transportation, purchasing and waste, energy and water. The guide also asks students to take the 'Sustainable Living Pledge' and sign electronically. This encourages students to follow through with sustainable principles discussed in the guide as well as helps to show the growing population that is committed to making sustainable living a priority.",http://sustain.appstate.edu/greenstudents,True,"There is a student dedicated to the sustainability beat.  The student newspaper is printed twice a week and is also available online.  

",http://www.theappalachianonline.com/,True,"2013 Sustainability Yearbook catalogs Appalachian State's sustainability progress through engaged students, academics and research, and campus initiatives.",http://issuu.com/appalachianstateuniversity/docs/sustain_book_issu,True,"Faculty Sustainable Research Forum- In an effort to highlight the sustainability-focused scholarly activities of Appalachian’s distinguished faculty, the university will present the 1st Annual Sustainability Research Forum  on October 22nd (National Campus Sustainability Day).  In support of the 2014-2019 Appalachian State University strategic plan, The Appalachian Experience: Envisioning a Just and Sustainable Future, this forum will demonstrate Appalachian’s commitment to sustainability by showcasing the sustainability-related peer-reviewed research of three Appalachian scholars in a public forum.",--,--,,--,--,,--,--,,--,--,,--,--,,--,--,,--,--
Aquinas College,2016-03-21,2016-03-21 14:45:29,eimerjes@aquinas.edu,2.0,Pursuing,**,True,"The web site highlights the most recent Sustainability news and events, electronic versions of the monthly sustainability newsletter, and resources about sustainability pertinent to the campus population. There is also an extensive section on the Zero Waste Initiative, a section on metrics/indicators used to measure progress, and more. ",http://www.aquinas.edu/sustainability,True,Interns at the Center for Sustainability put together AQ Sustainability News that highlights sustainability on campus. The newsletter is distributed to key constituents via e-mail and made available electronically on the Sustainability Initiative site. ,--,True,"The Center for Sustainability uses the campus kiosk’s to inform students on ways to live sustainably, as well as zero waste events and speakers invited to the campus to discuss issues regarding sustainability. We also advertise on the two campus “blogs”: the Moose (which is directed towards students) and Acorn (which is designed for faculty and staff). In addition to this, the Center for Sustainability at Aquinas has an Instagram page and a Facebook page. ",https://www.facebook.com/CenterForSustainability,--,N/A,--,True,Centralized signage summarizing green building features are posted.,--,True,"Product specific educational signage is placed as appropriate next to local and organic products. A map of Michigan is prominently displayed with callouts of local vendors served in the cafeteria. Compostable disposables are clearly labeled, as are the waste stations for disposal. ",--,--,N/A,--,True,Aquinas provides a walking tree guide featuring 108 different tree and shrub species native to Michigan among Aquinas campus trails. It is also available virtually. ,https://nature.aquinas.edu/,True,"There are several guides for commuters: 
A Saint’s Guide to Sustainability includes an entire section on sustainable commuting. 
The Sustainability Initiative website contains a “Get Involved” section with a “Re-think Transportation” page that includes information about carpooling, the Rapid Bus System discounts, a video about how to use the bus, and biking.",https://www.aquinas.edu/sustainability/re-think-transportation,True,"The “AQ Bikes” page of the Campus Safety web site features information on the college’s bike rental program, a link to bike trails in the Grand Rapids area, a bicycle safety video, and a FAQ section aimed at bicyclists and pedestrians. ",https://www.aquinas.edu/campus-safety,True,"A Saint’s Guide to Sustainability includes information about reducing waste, making local food choices, getting involved on campus, sustainability policies, and alternative transportation programs. ",--,--,N/A,--,True,Recycling and Composting Guide that highlights what items are accepted and which are not accepted.,--,True,"Aquinas College Excessive Idling Policy pamphlet to explain who the policy applies to, how it will be implemented, and why it is important.",--,True, Aquinas LEED Certified Buildings pamphlet featuring LEED certified buildings on campus. ,https://www.aquinas.edu/sites/default/files/FinalBrochure-October2012.pdf,--,,--,--,,--,--,,--,--,,--,--,,--,--
