University of Massachusetts Amherst,2015-12-17,2015-12-17 14:45:26,esmall@facil.umass.edu,2.0,Pursuing,True,"The two main forests are:
1.	Mt. Toby Demonstration Forest:   It was acquired in 1916 and consists of 755 acres.
2.	Cadwell Memorial Forest:  It was acquired in 1952 and consists of 1171 acres.

These two forests are listed under Article 97 Legislation of Massachusetts, which requires that the land is for open space, conservation, and environmental education and environmental research and other related natural resource purposes consistent with Article 97.  This also means that the land of these two forests cannot be used for any other purposes, unless Massachusetts legislation changes the use of the land.
",True,True,"Campus planning has done a full assessment of the campus natural systems on the campus.  This information can be found online here: http://www.umass.edu/cp/cns.htm.

Wildlife assessments are conducted by students in the Natural Resources Conservation (NRC) 564 Wildlife Habitat Management course taught by professor Paige Warren.  Their semester-long projects aim to develop comprehensive habitat management plans for wildlife on campus. They are provided guidance on how to make their plans compatible with other campus wide initiatives such as the Campus Master Plan and the Campus Sustainability programs.  Most recent year assessed was 2014.","Prexy's Ridge Forest: Prexy‘s Ridge Forest is an old growth forest on the westward steep slope southeast of the intersection of Eastman Lane and North Pleasant Street. Part of the Waugh Arboretum, the Forest is a unique educational, research, and recreational asset for the campus and should be preserved.","Every time we go to build a new building, the process always includes the consideration for the preservation of wildlife habitats.  Preservation of wildlife habitat is rooted deep in the culture of planning at UMass Amherst.  The UMass Amherst Extension Citizen Planner Program offers resources for developing bi-laws in local governments for wildlife habitat protection (see link below).",http://www.umass.edu/masscptc/bylaws/WetandWild_Mo.html,--
University of Massachusetts Lowell,2016-02-04,2016-02-04 11:33:01,Tyler_Arrigo@uml.edu,2.0,Not Pursuing,--,--,--,--,--,--,--,--,--
University of Michigan,2016-01-11,2016-01-11 15:37:34,ahorning@umich.edu,2.0,Pursuing,--,,True,True,"The University of Michigan, Matthaei Botanical Gardens and Nichols Arboretum (MBGNA) conducted an inventory of rare plants and plant communities on our properties and a portion of related information is available at our website (http://www.lsa.umich.edu/mbg/see/gis/).  This work was done through a recent Institute of Museum and Library Services grant.   In addition, we have several other past botanical surveys in which threatened or endangered plant species have been identified.  
As for rare migratory/animal species, we have some inventory work done but recognize that it is not complete.  We have done some survey work of our herptile populations but would like to do more.  We currently have a grant through the Sustain Our Great Lakes program of the US Fish and Wildlife Foundation for managing habitat of the eastern massasauga.  For bird species, we have informal information from the Washtenaw Audubon Society and others who have conducted butterfly surveys and/or done bird counts/walks and could well have some migratory warblers move through that are listed species.  Our surveys of mammals are definitely incomplete.  We have had some small mammal surveys done years ago in Dow Field, and some study of bats at Matthaei, but we have nothing that's been done completely.   The natural communities and their native plants have now been surveyed, mapped and assessed for floristic quality, providing a baseline of information for prioritized stewardship and monitoring. With this information we will also create a set of natural area stewardship recommendations","The eastern massasauga rattlesnake is the only venomous snake in Michigan and is listed as a species of special concern. The snake thrives on the Botanical Gardens property, where it often uses crayfish burrows as winter hibernation quarters and can be seen moving from one location to another during the spring and fall.  There are also a number of rare or conservative plant species such as twinleaf, early buttercup, and American burnet found on the MBGNA properties.","The University of Michigan MBGNA has used grant monies from the Sustain Our Great Lakes program coordinated by the National Fish and Wildlife Foundation to fund habitat restoration work for the eastern massasauga rattlesnake.   In Phase I staff improved nearly 65 acres of habitat by removing invasive shrubs, which encourages native species; purchased, planted, and caged 150 disease-resistant American elms; and sowed 75 gallons of native-plant seeds, among other efforts. Two major conservation goals for Phase II are ecological restoration work on 50 new acres of massasauga habitat and the removal of exotic invasives on 25 of those acres.",http://www.lsa.umich.edu/mbg/see/gis/,--
"University of Minnesota, Duluth",2016-02-26,2016-02-26 14:48:08,mgranley@d.umn.edu,2.0,Pursuing,--,,--,--,,,"Care is taken to preserve natural habitat around campus. The Bagley Nature Area is 55 acres of green space and forest, adjacent to campus, that is home to much wildlife.  Invasive species (including Buckthorn) are identified and removed in a sensitive manner.  

Three ponds around campus support wildlife, and duck houses/ramp were added in the Swenson Science Building pond to ensure ducklings do not get trapped. 

Only if an animal becomes a problem is it removed. ",http://www.d.umn.edu/fm/,--
"University of Minnesota, Morris",2016-02-24,2016-02-24 11:28:51,good0044@morris.umn.edu,2.0,Not Pursuing,--,--,--,--,--,--,--,--,--
"University of Minnesota, Twin Cities",2016-03-03,2016-03-03 17:48:32,stennes@umn.edu,2.0,Pursuing,True,"Sarita wetlands on the St. Paul campus. Located in the southeast corner of the University of Minnesota St. Paul campus, the Sarita Wetland is what remains of the Sarita Lake, which was drained in the 1800s. The Sarita Wetland Restoration Project began with the creation of the former Sustainable Campus Initiative in 2000. The purpose of the project was to implement innovative storm-water management techniques on a substantial area of campus. 

The Minneapolis campus is bisected by the Mississippi River National River and Recreation Area. The river enters the northern corridor as a free-flowing prairie river and moves downstream to plunge over St. Anthony Falls and into the river's narrowest gorge. Eight and one-half miles later, the river exits the gorge to become the country's dominant floodplain river and part of the largest inland navigation system on earth. Through the eight and one-half mile gorge, the Mississippi drops more than 110 feet, the river's steepest descent anywhere. The river's rapidly changing character explains why the national river and recreation area has such a unique concentration of nationally significant resources. The portion of the park adjacent to the University includes the gorge portion downstream of St. Anthony Falls.   
",True,True,"About the IIC
The Interagency Information Cooperative (IIC) was created from the Sustainable Forest Resources Act of 1995. See the Minnesota Forest Resources Council (MFRC) website for the origin and details of the SFRA legislation and the specifics of the IIC charter (Minnesota Statutes 89A.09).
The mission of the IIC is to enhance the access and use of forest resources data for the management of forestlands in Minnesota. The statutes urge the dean of the University of Minnesota, College of Food, Agricultural and Natural Resource Sciences, to coordinate the establishment of the IIC. In practice, the head of the University’s Department of Forest Resources serves as the IIC director of operations.
Members of the cooperative include:
(1) the University of Minnesota, College of Natural Resources;
(2) the University of Minnesota, Natural Resources Research Institute;
(3) the Department of Natural Resources;
(4) the Minnesota Geospatial Information Office;
(5) the Minnesota Association of County Land Commissioners;
(6) the United States Forest Service; and
(7) other organizations as deemed appropriate by the members.

Rare Plants and Animals
Minnesota County Biological Survey—The Minnesota County Biological Survey (MCBS) began in 1987 as a systematic survey of rare biological features. The goal of the Survey is to identify significant natural areas and to collect and interpret data on the distribution and ecology of rare plants, rare animals, and natural communities.
Minnesota Natural Heritage Information System (NHIS)—The program’s goal is to identify Minnesota’s ecologically significant natural lands. It conducts inventories and research, manages data in a computer-based system, and provides technical advice on Minnesota’s native habitats and rare species. The program identifies and locates significant examples of Minnesota’s plant and animal species, plant community types, special wildlife habitats, and special geologic features.
Minnesota’s List of Endangered, Threatened, and Special Concern Species—Minnesota’s Endangered Species Statute (Minnesota Statutes, Section 84.0895) requires the Minnesota Department of Natural Resources (MnDNR) to adopt rules designating species meeting the statutory definitions of endangered, threatened, or species of special concern. The resulting List of Endangered, Threatened, and Special Concern Species is codified as Minnesota Rules, Chapter 6134. The Endangered Species Statute also authorizes the MnDNR to adopt rules that regulate treatment of species designated as endangered and threatened.  These regulations are codified as Minnesota Rules, Parts 6212.1800 to 6212.2300.
Minnesota’s List of Species in Greatest Conservation Need—A list of wildlife species in greatest conservation need (SGCN’s) shows species on the endangered, threatened, and special concern list, as well as species which are considered at risk for a variety of reasons. In general, SGCN’s are animal species whose populations are rare, declining, or vulnerable in Minnesota.","Located in the southeast corner of the University of Minnesota St. Paul campus, the Sarita Wetland is what remains of the Sarita Lake, which was drained in the 1800s."," The Sarita Wetland Restoration Project began with the creation of the former Sustainable Campus Initiative in 2000. The purpose of the project was to implement innovative storm-water management techniques on a substantial area of campus. For more detail on the history of the Sarita Wetland, see this page.

In addition to restoration projects, the wetland is also a site for education and research. The student projects listed below, previously archived by the Sustainable Campus Initiative, represent academic work related to the Sarita Wetland and campus sustainability.",http://www.susteducation.umn.edu/resources/university/sarita-wetland/,--
University of Missouri,2015-05-01,2015-05-01 15:33:43,raghavans@missouri.edu,2.0,Pursuing,True,"There are three areas under Columbia Parks and Recreation protection directly adjacent to the University of Missouri Main Campus.  They comprise 239 acres (96.8 ha) and include Grindstone Nature area (199 acres; 80.6 ha), Capen Park (32 acres; 13 ha), and Grasslands Park (8 acres; 3.2 ha).  

The Baskett Wildlife Research and Education Center is a University-owned and managed 2,226 acre (917.4 ha) nature preserve located within the Mark Twain National Forest in Boone County.  Baskett is approximately 15 miles from Main Campus and is an integral part of the School of Natural Resources mission of teaching, research, and extension.  

The University's objectives for the area were to:
*  Operate and manage the area as an arboretum and wildlife refuge;
*  Conduct investigations, experiments and research studies in botany, zoology, wildlife and game management. 

The MU College of Agriculture, Food and Natural Resources Agricultural Research Centers are a system of centers across Missouri, extending CAFNR's research to nearly 14,000 acres to meet the regional research and demonstration needs of agricultural producers and natural resource managers.  (http://cafnr.missouri.edu/research/outstate.php)

Within 20 miles of the University are 28 legally protected areas that are administered by one of the following:  the USDA Forest Service, the Missouri Department of Natural Resources, the Missouri Department of Conservation, or the City of Columbia Parks and Recreation Department.  These areas cover a total of 31,290 acres (12,668 ha) and average 1,117 acres (452 ha) in size.  
",True,True,"Working in partnership with the Missouri Department of Conservation, research staff have set aside a 7-acre prairie area adjacent to the Graves-Chapple Research Center (part of the University’s out-state research network) in northwest Missouri. A rare, native yucca plant was identified there, and the prairie project allows for research into habitat restoration and management for conservation.","Bobwhite Quail, a culturally significant species in Missouri. Areas near farmland that with proper management can provide habitat for Bobwhite Quail, pollinators such as honeybees, and other species. 

In addition, MU agreed to preserve 311 acres of land within the Baskett Wildlife, Research and Education Center for promoting biodiversity in compliance with the University's Sustainable Design Standards (SDG) and Climate Action Plan (CAP) goals.","Farming systems, once beneficial for bobwhite and many other wildlife species, included a diversity of habitats such as fencerows, shrubby cover, crop rotations, fallow/weedy fields, mixtures of native grasses and forbs and inefficient grain handling.
With the increase in farm size, clean and weed-free fields, and more efficient harvest practices, many farmers have been able to stay in business, but quality early successional vegetation that provide habitat for bobwhites and grassland birds has been greatly reduced.
Bradford Research Center works to implement techniques that can be used to enhance wildlife habitat on the farm. For example:
•	Farming up to the edge of a wooded draw results in a lack of edge and fencerow habitat which also resulted in poor yields.
•	Waterways and diversion channels were formed and are typically planted to tall fescue which although is an excellent guard against erosion it is not a very wildlife friendly grass.
•	Unmanaged Native Warm Season Grasses were of little use to bobwhite quail except for escape cover because of a lack of bare ground.
•	Natural prairie and wetland remnants were invaded with non-native species such as Reedcanary grass and Sericea Lespedeza which can be invasive and offer little benefit to wildlife.
•	Strip disking native warm season grasses in the fall and spring open up the understory for more beneficial forbs (non grass species) and annual grasses which allows bobwhite quail ample bare ground to move through. Anuual forbs and grasses are also a source of seed and most importantly a source of insects for baby quail chicks.
•	Fall and Spring prescribed burning help reduce the competition of the native warm season grasses and encourages forbs and annual grasses.
•	Predominance of tall fescue and little shrubby cover across much of the farm.
•	Field border/edge management around crop fields. A mixture of native grasses and forbs are planted in 30-120 borders around field edges to provide food, nesting ground, and cover for bobwhite quail and other species.
•	Using a mixture that is heavy with native forbs this area already provides an excellent food source for quail and other bird species.
•	Tall fescue has been replaced with native warm and cool season grasses that provide a better food source for bobwhite quail.
•	Covey Headquarters have been established at several locations on BREC. These headquarters are a mixture of shrubs that are beneficial to bobwhite quail throughout the year.
•	Different mixes of native cool season and warm season grasses were planted in a diversion channel to compare those and tall fescue (middle) for their suitability for erosion control and wildlife benefit. One native cool season grass, Virginia Wildrye (front), emerged quickly and has done quite well.
",--,--
"University of Missouri, Kansas City",2016-02-17,2016-02-17 12:08:16,johnstonrk@umkc.edu,2.0,Pursuing,--,,--,--,,,"Landscape Services leave  trees with holes that could house animals or birds and
along some of the fence lines Landscape Services  have allowed the areas to grow native in 5 year increments. The 5 Rain Gardens on campus are our best examples of wildlife habitats. Landscape Services also practice the use of dormant oil during the early Spring to suffocate insect eggs, also use Spinosad or BT which are biological insect controls and Integrated Pest Management Techniques.  They also use pest free plants to prevent the use of insecticides.
",http://info.umkc.edu/sustainability/green-campus/landscaping/,--
University of Mount Union,2016-01-13,2016-01-13 13:05:27,mcclauca@mountunion.edu,2.0,Pursuing,True,Our Huston-Brumbaugh Nature Center owns land that protects a set of primary headwater streams and old growth forest,True,True,"Th site has been regularly studied by student in biology, geology and environmental sceince classes pver the past 25 years.","Headwater stream, upland wetlands, old growth forest","Thu Huston Brumbaugh Nature Center has a land use plan that protects these area and also the deed  has a restriction that requires the land be preserved as  ""wildlife preserve""",http://www.mountunion.edu/nature-center,--
University of Nebraska - Lincoln,2016-02-25,2016-02-25 15:44:57,pshrestha3@unl.edu,2.0,Not Pursuing,--,--,--,--,--,--,--,--,--
University of Nebraska at Omaha,2016-02-19,2016-02-19 11:12:33,slburke@unomaha.edu,2.0,Pursuing,True,"Glacier Creek Preserve is a topographically diverse nature preserve dedicated to the study and appreciation of the tallgrass prairie and associated ecosystems of Eastern Nebraska. The site provides critical habitat for prairie flora and fauna with opportunities for education, research, and appreciation of prairie ecology and management. The preserve is composed of three tracts, including the Allwine Prairie Tract (the original preserve), Papio Tract and North Viewshed Tract. The Barn @ Glacier Creek, scheduled for completion in Fall 2013, is an on-site Environmental Education and Research Facility that will provide a field connected laboratory for use by classes as they expand on their field investigations.",True,True,"Butterfly Monitoring
Since 1998, twenty weekly Pollard Transect butterfly population censuses have been conducted each year from early June to mid October; since 2001, data have also been collected on nectar plant visits by butterflies observed in the censuses.  These data provide a characterization of the butterfly community at the Allwine Prairie tract of Glacier Creek Preserve and the nectar plants utilized by the butterfly community, seasonal and annual variations in the community, and determination of the effects of control burns.  Following creation of a habitat corridor in 2011 connecting the South and West units, studies have characterized the use of the habitat corridor by the butterfly community, especially the Regal Fritillary, a species of conservation concern.  Beginning in 2013, studies of the efficiency and significance of butterflies as pollinators are also ongoing.
 
Other Monitoring
Other quantitative data or surveys have been collected on flora and grassland birds. Quantative surveys of small mammals and of vegetation were conducted in 2012-2013 on the un-farmed portions of the Papio Tract as a first step in long-term monitoring.
Weather data are collected continuously. We also monitor water flow at the spring-fed Glacier Creek as well as siltation along the western lowland adjacent to farmed ground. loral surveys, butterfly and grassland bird surveys, and water quality monitoring of Glacier Creek.","Over 109 species of birds, 12 species of amphibians and reptiles, and 24 species of mammals have been observed in various locations throughout the Preserve.  Breeding bird species include the Bobwhite Quail, Mourning Dove, Meadowlark, Dickcissel, and Grasshopper Sparrow.  The prairie also serves as a haven to migrant species such as LeConte’s and Harris’ Sparrows, Marsh Hawks, and Blue-Winged Teal; other species overwinter on the Preserve.  Mammals of the prairie and woodland include the White-tailed Deer, Thirteen-lined Ground Squirrel, Prairie Deer Mouse, White-footed Mouse Prairie Vole, Coyote and Red Fox. Fox Snakes and Red-sided Garter Snakes are also relatively common. Thousands of insects reside at the prairie, including 54 butterfly species.

More than 280 species of woody and herbaceous plants have been identified at the Allwine Prairie Tract of Glacier Creek Preserve. Quantitative surveys of the preserve find slopes and hilltops of the tallgrass areas dominated by big bluestem with little bluestem and sideoats grama common. Lowland areas are predominantly big bluestem, reed canary grass and switchgrass.  Little bluestem and sideoats grama dominate the mixed-grass prairie. Common forbs include wild indigo, black-eyed susan, leadplant, round-headed bush clover, greyhead prairie coneflower, rosinweed, Missouri goldenrod and Canada goldenrod.","Vegetation & Fire Effects Monitoring
Ongoing research at Glacier Creek Preserve includes long-term plots established in 1978 which were established to study the effects of fire frequency and season-of-occurrence on grassland plant community composition. In addition, landscape vegetation surveys of the Allwine Prairie tract were conducted in 1979, 1993 and 2009.
 
Butterfly Monitoring
Since 1998, twenty weekly Pollard Transect butterfly population censuses have been conducted each year from early June to mid October; since 2001, data have also been collected on nectar plant visits by butterflies observed in the censuses.  These data provide a characterization of the butterfly community at the Allwine Prairie tract of Glacier Creek Preserve and the nectar plants utilized by the butterfly community, seasonal and annual variations in the community, and determination of the effects of control burns.  Following creation of a habitat corridor in 2011 connecting the South and West units, studies have characterized the use of the habitat corridor by the butterfly community, especially the Regal Fritillary, a species of conservation concern.  Beginning in 2013, studies of the efficiency and significance of butterflies as pollinators are also ongoing.
 
Other Monitoring
Other quantitative data or surveys have been collected on flora and grassland birds. Quantative surveys of small mammals and of vegetation were conducted in 2012-2013 on the un-farmed portions of the Papio Tract as a first step in long-term monitoring.
Weather data are collected continuously. We also monitor water flow at the spring-fed Glacier Creek as well as siltation along the western lowland adjacent to farmed ground. loral surveys, butterfly and grassland bird surveys, and water quality monitoring of Glacier Creek.",http://www.unomaha.edu/prairie/glaciercreek.php,--
