Southern Illinois University Carbondale,2016-03-25,2016-03-25 17:21:57,glkurtzhals@siu.edu,2.0,Not Pursuing,--,--,--,--,--,--,--,--,--
Southern Oregon University,2016-03-23,2016-03-23 15:38:35,beigelcod@sou.edu,2.0,Pursuing,True,"SOU’s Ashland Campus is settled in the foothills of the Siskiyou mountain range and our region is recognized as a global biodiversity hotspot. The International Union for the Conservation of Nature labeled it as an Area of Global Botanical Significance. Our campus is a certified wildlife habitat by the National Wildlife Federation. There are currently eight large scale designated pollinator habitat areas on campus, four of which are displayed and signed as Xerces Society Pollinator Habitats. SOU’s Roca Creek area is designated as a pesticide free zone and used as an educationally, protected riparian site and is a “region of conservation importance”. There are over 20 mycologically inoculated logs on campus in sites identified for biodiversity and the SOU Farm: A Center For Sustainability, contains a designated wetland.",True,True,Professional visual assessment in connection with the use of a dichotomous key was used to identify the trees on campus. The environmentally sensitive wetland area on the Ashland campus was inspected by the Department of State Lands. SOU is committed to protecting critical wildlife and their habitat now and in the future. The SOU Tree Advisory Council oversees the protection of the trees on campus through the use of the SOU Campus Tree Care Plan. ,"The following species of tree have been positively identified on the SOU Ashland Campus by multiple International Society of Arborist (ISA) certified arborists. These trees are all listed by the International Union for Conservation of Nature as either Near Threatened, Vulnerable, or Endangered.  

Cupressus bakeri - http://www.iucnredlist.org/details/34047/0 Vulnerable

Metasequoia glyptostroboides - http://www.iucnredlist.org/details/32317/0 Endangered

Sequoia sempervirens - http://www.iucnredlist.org/details/34051/0 Endangered

Sequoiadendron giganteum - http://www.iucnredlist.org/details/34023/0 Endangered

Chamaecyparis lawsoniana - http://www.iucnredlist.org/details/34004/0 Near Threatened 

Chamaecyparis obtusa - http://www.iucnredlist.org/details/42212/0 Near Threatened 
 
Abies pinsapo - http://www.iucnredlist.org/details/42295/0 Endangered","Every year the SOU Landscape Department prioritizes tree selections based on locally grown, environmentally sustainable, and critical species for tree replacements and new plantings. In 2014 the Landscape Department planted 18 trees from the vulnerable, near threatened, threatened, or endangered tree list. We also perform visual tree health assessments annually and dedicate funds to tree preservation.",https://sou.edu/fmp/landscape.html,--
Spelman College,2016-02-15,2016-02-15 08:21:30,aefrazier@spelman.edu,2.0,Pursuing,--,,--,--,,,,--,--
St. John's University,2016-03-02,2016-03-02 16:31:39,goldsmit@stjohns.edu,2.0,Pursuing,--,,--,True,"The Sustainability Department wanted to efficiently use the Organic Garden on campus to promote the greatest impact for the small space. Different projects were discussed and research by Sustainability Coordinators resulted in the idea of a ""Pollinator Garden"" that would help native species and promote more healthy organic produce for donation.  The idea for this project came from other programs such as the ""Great Pollinator Project""(http://greatpollinatorproject.org/conservation/major-threats-to-pollinators). Sustainability Coordinators monitor and maintain the garden's progress.","The past few decades have shown a major decrease of local insects to the area,including many pollinator insects such as butterflies and bees. Although our garden space is limited, a pollinator garden was planted to help these local insects; as well as birds and the pollination of the organic garden.","A pollinator garden has been established to attract and provide a haven for bees, butterflies and birds. Within weeks of the garden's establishement, the presence of pollinators had increased by at least 500% over the past 5 years. Since the school is located on a relatively small space in a very urban environment, a project creating a habitiat for small wildlife like bees, butterflies and birds is the largest reasonable scope for the campus.",--,--
Stanford University,2016-03-23,2016-03-23 01:12:23,mbhafer@stanford.edu,2.0,Pursuing,True,"San Francisquito Creek, including the Stanford portions of Los Trancos, Bear, and Corte Madera creeks, are designated as “Critical Habitat” for the local, federally protected, steelhead. The serpentine grasslands present at Jasper Ridge are “Critical Habitat” for the Bay checkerspot butterfly. There is a permanent 30-acre conservation easement in the lower foothills, which was designated in order to help preserve the California tiger salamander (there is also another 285 acres in the lower foothills designated “no build” for 50 years, also to help protect the tiger salamander). In summer of 2014, 90 acres of creek and riparian vegetation were permanently set-aside in order to help protect the federally protected California red-legged frog.  ",True,True,"Scientists from the University have been studying the local flora and fauna since the founding of the University. The more than 100-years of work has resulted in a fantastic baseline database on the species and biological communities present in the area.  Since the early 1990s, this baseline information has been expanded by targeted work specifically looking into species and communities considered to be at risk.","Nearly 700 species of native plants, 20 species of reptiles and and amphibians, and 50 species of mammals have been recorded from Stanford lands. Additionally, more than 180 species of birds are observed on University lands with some regularity. Included in this diversity are many species accorded some level of either local, state, or federal protection.  Three terrestrial species with federal protection are California tiger salamander, California red-legged frog, and Bay checkerspot butterfly. The local form of steelhead is also federally protected.  

At a community-level, the wetlands, the serpentine grasslands, and the oak woodlands are all considered environmentally sensitive.  
","Since the 1990s, the university has engaged in campus-wide conservation planning.  The culmination of this effort came in the summer of 2013 when Stanford implemented a Habitat Conservation Plan, including approximately 3,500 acres of Stanford land (the plan for the remainder of the university’s land was approved at the same time, but has been put on hold pending the outcome of the major environmental planning effort concerning Searsville Reservoir). 

Additionally, Stanford’s Jasper Ridge Biological Preserve contains more than 1,000 acres of land set aside to support biological research. The management of this academic facility supports the preservation of local biodiversity while acting as a living laboratory for students and faculty. More information about Jasper Ridge Biological Preserve is available at http://jrbp.stanford.edu/. 
",http://hcp.stanford.edu/,--
State University of New York College of Environmental Science and Forestry,2016-03-23,2016-03-23 01:49:37,malichte@esf.edu,2.0,Pursuing,True,"Adirondack Forest Preserve. 
Early in the last century, the College began to assemble a system of properties that would broadly represent New York’s rich ecological diversity for scientific study and instruction. Today, approximately 25,000 acres of regional campus lands and facilities offer unparalleled learning and research opportunities. The size, scope, and ecological diversity of ESF's regional properties make it unique among institutions of higher education. Together, these lands constitute one of the largest college campuses in the world. Several of the regional campuses are located within the boundary of the 6 million acre Adirondack Forest Preserve: 
- Wanakena Campus: The Ranger School; James F. Dubuar Memorial Forest)
- Newcomb Campus: Adirondack Ecological Center; Anna and Archer Huntington Wildlife Forest; Adirondack Interpretive Center; Northern Forest Institute
- Cranberry Lake Biological Field Station: Charles Lathrop Pack Experimental Forest
- Warrensburg Campus: NYS DEC Environmental Education Camp; Charles Lathrop Pack Demonstration Forest
ESF Regional Campuses outside the Adirondacks: 
- Tully Campus: Svend O. Heiberg Memorial Forest & Tully Field Station
- Lafayette Road Experiment Station
- Thousand Islands Biological Station",True,True,"Over eighty years of research have been incorporated into over 30 ongoing monitoring efforts at ESF's Adirondack Ecological Center (AEC). The Adirondack Long-term Ecological Monitoring Program (ALTEMP) currently monitors over 100 physical, chemical, and biological attributes to provide the long-term perspective necessary to detect changes and identify trends in the Adirondack ecosystem. More than 70 ongoing basic and applied research programs investigate the restoration of wildlife, development of new forestry, impact of acidic deposition on soils and lakes, social organization of deer, movement of soil ions, silvicultural regimes, Adirondack Park biodiversity, and much more. Nearly 200 graduate degrees stem from studies conducted at this site to date. 
http://www.esf.edu/aec/ ","- Forest Communities: Mountain Conifer (Spruce Slope), Upper Slope Hardwood Conifer, Northern Hardwood, Hardwood-Conifer (Mixedwoods), Lowland Conifer (Spruce Flat), Conifer Swamp (Spruce Swamp), 
http://www.esf.edu/aec/adks/forestcomm.htm
- Mammals: http://www.esf.edu/aec/adks/mammals/ 
- Amphibians and Reptiles: http://www.esf.edu/aec/adks/herps.htm
- Birds: http://www.esf.edu/aec/adks/birds.htm 
- Butterflies: http://www.esf.edu/aec/adks/butterflies.htm ","The Huntington Wildlife Forest’s (HWF) Strategic Plan mandates that forest manipulations must: maintain ecological integrity of all populations of threatened or endangered plants and animals, unique plant and animal communities, and all lake, stream and wetland areas; identify and, where possible, halt the invasion of invasive species; and identify and protect cultural resources. The HWF strategic plan also identifies Long-term Management Zones that call for allowing natural processes and natural vegetative succession to be the predominant influence.  In addition, the the SUNY Board of Trustees designated a  971-acre Natural Area in 1941 to provide an area in the HWF for long-time studies of natural conditions untouched by forest operations.  This area represents one of the few remaining large old-growth hardwood and mixed wood forests on HWF. ",http://www.esf.edu/aec/documents/HWF-NaturalResourcesPlan.pdf,--
State University of New York at Cortland,2015-10-09,2015-10-09 13:15:56,Beth.Klein@cortland.edu,2.0,Pursuing,True,"The campus Outdoor Education Facility is located at Adirondacks Park , Raqeutte Lake which is adjucents to the state preserve land. Teh site also is a National Historic Landmark.

Main campus at Cortland is also adjacent to the City of Cortland  Water Works a preserve for the water department.",True,True,"Methodologies used to identify environmentally sensitive areas include an assessment of the property and the surrounding geography and species.  In many cases, the properties have been owned by SUNY Cortland for a long period of time, as conservation interest and attention to habitat and biodiversity protection have increased and or developed SUNY Cortland has been supportive to those efforts and works with the government agency or entity that has developed the biodiversity protection criteria.  The species assessment includes fish / aquatic and wildlife habitat, forest and vegetation, and open space assessment.  This assessment approach is consistent with New York State Department of Environmental Conservation requirements associated with NYS Natural Heritage Program, Critical Environmental Areas.  Portions of all preservation areas owned by SUNY Cortland are assessed each year.  The assessment is completed predominantly by biology, ecology, and geography departments during visits and summer session intensive programs to the individual sites.  In addition to these hands on learning activities, the following distinct conservation efforts should be noted:  
Raquette Lake Property is within the Adirondack State Park which has its own specific set of governing developmental and site use regulations that govern the property owned by SUNY Cortland as well as the surrounding adjacent properties.  Of note, directly adjacent the Raquette Lake property is a “Wild Forest Area” as defined by New York State DEC.  Within this  Wild Forest Area are areas of Rare Plants and Rare Animals that receive additional classification by DEC through their New York State Natural Heritage Program.   In addition to the Rare Plants and Rare Animal distinction there is also an area of “Significant Natural Communities” which is also classified through DEC’s Natural Heritage Program.  Also of unique note, the buildings on the property are designated as a National Historic Landmark, the first within the SUNY system.  
The Hoxie Gorge has registered Old Growth Forest within its boundary and is adjacent the Hoxie Gorge State Forest as designated by the New York State Department of Conservation.  The Old Growth Forest is registered with the Old-growth Forest Network.  In addition to the State Forest being adjacent to the site, SUNY Cortland establishes area of no disturbance, or no access depending on the level of species activity.  This could be for certain migratory bird species, or certain periods of time throughout the year associated with a specific life cycle of a unique species.  
The Brauer Education Center is located within land that is designated by the DEC’s New York State Natural Heritage Program as having Rare Plants and Rare Animals, and a geologically unique area.  
SUNY Cortland has also been recognized by the Arbor Day Foundation earning the distinction of Tree Campus USA.  SUNY Cortland went through an extensive documentation process complying with the five core assessment areas of the Tree Campus USA program.  Maintain a Campus Tree Advisory Committee, establish a tree-care plan, document a specific annual expenditure to the tree-care plan, annual Arbor Day observance, and the institution needs to sponsor a student in a service-learning project associated with the forestry of the campus.   
Utilizing the New York State Department of Environmental Conservation as well as the Arbor Day Foundation environmental assessment methodologies SUNY Cortland has developed a very comprehensive understanding of the environmental attributes associated with our properties.  This information shared and imbued into the curriculum which further builds upon current reassessment work and closely monitors the health and viability of these resources for future generations of students.   
","The primary areas assessed by the campus include a variety of species, habitats and environmentally sensitive or unique settings.  For the Tree Campus USA assessment, 53 varieties of trees were identified and  logged into a database.  Some of the varieties include: dawn redwood, English oak, gingko, green ash, honey locust, lofty elm, black walnut, and London Plane Tree, and Hemlock.  
At the Raquette Lake property some of the unique species within and adjacent to the area include boreal bird species such as: Wood Warblers and American Bittern. In addition to these boreal bird species, the Wild Forest area and Lake also includes loons, northern pike, bullhead, and fine red pine, white pine, and hemlock tree specimens.    
Hoxie Gorge has a stand of old-growth forest within its boundary.  This old-growth forest includes Hemlock which date back as old as 1736.  Other species dating back to the 1800’s include: sweet birch, red maple, and black cherry.  In addition to these tree species, the gorge is also superb bird habitat for yellow warbler, scarlet tanager, louisiana waterthrush, downy woodpeckers, bald eagle, pied-billed grebe, and more.  Some of these species and others comprise a list of Species of Greatest Conservation Need which provides additional protection status to the species.      
Brauer Field Station is a great sample of the Brauer tract of fossilized small stromotoperoid reef.  The property also contains many fossil-bearing Devonian limestone forms along two prominent cliffs.  
","The campus has three observation fields at Cortland County, Adirondacks Parks and the Albany area of which all three are preserves for wildlife.",--,--
State University of New York at Geneseo,2016-03-24,2016-03-24 10:59:21,dezarn@geneseo.edu,2.0,Pursuing,--,,True,True,NY state and EPA classifications,Roemer Arboretum is a 20 acre parcel of the campus that is reserved for native flora and fauna. ,"SUNY Geneseo has an on-campus Arboretum that provides a habitat for a multitude of plant and animal life. The Arboretum also serves as an area where students and faculty can engage in research, and facilitates out-door activities through the provision of foot-paths, picnic tables, and an outdoor gazebo. The organic garden is also located in this designated natural space.",http://arboretum.geneseo.edu/,--
State University of New York at New Paltz,2016-01-11,2016-01-11 09:08:16,mittenl@newpaltz.edu,2.0,Not Pursuing,--,--,--,--,--,--,--,--,--
Sterling College,2016-01-28,2016-01-28 10:04:16,cfeuerstein@sterlingcollege.edu,2.0,Pursuing,True,"Cedar Swamp is a class 2 protected wetland by Vermont state law. Also, the Virginia Russell Maple Sugarbush is a 27 acre woodlot that has just been certified by Vermont Audubon as a ""bird-friendly maple"" operation.",True,True,The Ecology classes use IBAT (Integrated Biodiversity Assessment Tool) to identify and assess environmentally sensitive areas. ,"The Cedar Swamp is located between the main campus and Hamilton and Jefferson residence halls. Nature trails wind through the thick stands of cedar trees, and wildlife sightings are common. Cedar trees love wet soil, and there is often standing water in parts of the swamp, home to frogs, salamanders, and aquatic invertebrates.

 The Virginia Russell Maple Sugarbush, abutting Sterling College’s campus and managed by its students and faculty, is home to over 200 maple taps and numerous species of birds. Both trees and birds will be able to coexist and thrive, thanks to the Bird-Friendly Maple Project, which just recognized the sugarbush as supporting both bird habitats and sugaring activity.

The Bird-Friendly Maple Project is a partnership among Audubon Vermont, the Vermont Department of Forests, Parks, and Recreation, and the Vermont Maple Sugar Maker’s Association. It seeks to promote bird conservation and maple syrup production.

More than 30 species of birds are known to use maple sugarbushes as nesting habitats, including the wood thrush, the scarlet tanager, and the black-throated blue warbler. Bird-friendly sugarbushes have features that allow birds to successfully raise the next generation, including a diversity of tree species, layers of vegetation, and a plan for invasive plant control.",We do not use Cedar Swamp for any stormwater or wastewater treatment; the college works with the Vermont Wetlands Program to ensure that we're correctly protecting the wetland. ,--,--
Stevens Institute of Technology,2016-03-24,2016-03-24 15:21:09,gotham360@stevens.edu,2.0,In Progress,--,--,--,--,--,--,--,--,--
Syracuse University,2016-03-25,2016-03-25 15:33:02,macadwel@syr.edu,2.0,Not Pursuing,--,--,--,--,--,--,--,--,--
Temple University,2016-02-09,2016-02-09 14:47:10,kathleen.grady@temple.edu,2.0,Not Pursuing,--,--,--,--,--,--,--,--,--
Texas A&M University,2016-01-15,2016-01-15 14:24:51,kwellman@tamu.edu,2.0,Pursuing,--,,True,True,Before using undeveloped lands the University has a Phase I and Threatened and Endangered Species Assessment conducted.,Currently no habitats identified.  ," 

.",http://vetmed.tamu.edu/wcwc,--
Texas Tech University,2016-03-25,2016-03-25 15:46:49,carey.hewett@ttu.edu,2.0,Not Pursuing,--,--,--,--,--,--,--,--,--
The Ohio State University,2016-01-26,2016-01-26 15:46:50,dial.15@osu.edu,2.0,Pursuing,True,"The Wilma H. Schiermeier Olentangy River Wetland Research Park is a long-term, large-scale aquatic research facility located along the northern edge of The Ohio State University’s Columbus campus. The Schiermeier Wetlands is the home of the School of Environment and Natural Resources’ aquatics program and a gateway to research, teaching and outreach related to water resources at the university. 

The wetlands park is listed as a Ramsar Site of International importance, and includes freshwater, tree-dominated wetlands, permanent rivers/streams/creeks, seasonal/intermittent freshwater marshes, and permanent freshwater marshes. It is a unique combination of 1) a biologically diverse assemblage of different wetland and riverine habitats both representative and unique to the region; 2) high-quality university teaching, research, and publishing related specifically to wetland ecology and management; and 3) significant wetland ecotourism and outreach for an urban community where few wetlands remain. The site has supported almost 160 bird species, diverse fish and invertebrate communities in the river and marshes, and a wide variety of mammals, amphibians and reptiles, all within an urban region. 
",True,True,"Ohio State conducts wildlife inventories and site surveys within the wetlands. For instance, the university completed electrofishing on a regular basis in rivers throughout Ohio including adjacent to our property in the Olentangy River down through main campus.  Additionally, Ohio State’s raises endangered species of spotted darter (Etheostoma maculatum) with the intention of releasing them into rivers throughout Ohio where they have been extirpated. Lastly, the university’s BioPresence project has been working to catalog wildlife throughout the campus using citizen science.",Identified wetland and its extents ,"The Wilma H. Schiermeier Olentangy River Wetland Research Park is a university campus facility in Ohio, USA, designed to provide teaching, research, and service related to wetland and river science and ecological engineering. At the research park, we seek to understand: 1) how wetlands function, and 2) if and how we can create and restore wetlands.

It is a long-term, large-scale wetland research facility. There is no other facility of its kind on any other university campus in the world, so it also has as its mission the dissemination of wetland science and ecological engineering around the world. 

The wetland research park is also a nature park for the residents of central Ohio, providing habitat for a wide variety of plants, mammals, reptiles, amphibians, and birds.",--,--
Tufts University,2016-02-25,2016-02-25 15:40:25,tina.woolston@tufts.edu,2.0,Pursuing,True,"Although the IBAT map does not show ""any legally protected areas, internationally recognized areas, priority sites for biodiversity, and/or regions of conservation importance"" near Grafton, Massachusetts, the Grafton campus master plan depicts watershed areas for the Grafton Water Department as well as wetlands for various wildlife and vegetation.",--,True,"The Grafton campus master plan identifies these areas.  Wildlife Program staff have recorded areas, and a third party prepared a forest management plan.","Watershed and wetlands, Blue Spotted Salamanders, spotted owls, moosewood lady slippers as well as many species of protected invertebrates. There is preferred habitat of the long-eared bat, although there are no bats currently residing in it. ","Not allowing the use of neonicotinoids for systemic pest controls, which has been linked to honey bee decline.",--,--
Tulane University,2016-02-04,2016-02-04 11:03:54,ldavey@tulane.edu,2.0,Pursuing,--,,True,True,"By assessing the endangered species in Louisiana through both the IUCN Red List and State records of endangered, threatened, and vulnerable species a rough draft of the endangered species that land owned by Tulane could support was created based on the regions that these animals were known to inhabit (2014). This list was sent to Dr. Thomas Sherry, an ecology professor at Tulane University, who made edits to the list for what animals were most likely to be found on land that Tulane manages. A list compiled by Dr. Steven Darwin, of the ecology and environmental biology department of Tulane University, identified ecologically important plant species, both native and nonnative that is regularly referred to when new landscaping is done on campus.","The Least Tern tends to breed on flat-topped buildings in the New Orleans area so its possible that they could be found on some buildings on Tulane’s Riverside Property. The Red-cockaded Woodpecker, Gopher Tortoise, and Dusky Gopher Frog are all native to the North Shore of Lake Pontchartrain where Tulane’s Primate Center is located. Peregrine Falcons and Bald Eagles have been seen in the New Orleans area for the winter or breeding and the habitat by Tulane’s Primate Center is suitable for them as well.","A tree advisory committee, a campus tree-care plan, dedicated annual expenditures for its campus tree program, an Arbor Day observance event, and the sponsorship of student service-learning projects serve to protect and maintain habitats on campus that could support environmentally important animals.",http://tulane.edu/oua/upload/Tree-policy-procedures-and-plan-10-23-13-final.pdf,--
Unity College,2016-03-25,2016-03-25 15:24:12,JdeHart@unity.edu,2.0,In Progress,--,--,--,--,--,--,--,--,--
